[
  {
    "id": "small_farm",
    "name": "Small Farm",
    "category": "farm",
    "constructionCost": 1500000,
    "monthlyOperatingCost": 8000,
    "footprint": {
      "width": 3,
      "height": 3
    },
    "maxUnits": 3,
    "producibleTiers": [
      "raw"
    ],
    "targetHeadcount": {
      "min": 5,
      "max": 15
    },
    "geographyRequirement": {
      "arable": true
    },
    "levels": [
      {
        "level": 1,
        "capacity": 3,
        "monthlyOperatingCost": 8000,
        "upgradeCost": 0
      },
      {
        "level": 2,
        "capacity": 4,
        "monthlyOperatingCost": 10400,
        "upgradeCost": 900000
      },
      {
        "level": 3,
        "capacity": 6,
        "monthlyOperatingCost": 12800,
        "upgradeCost": 750000
      }
    ],
    "staff": {
      "fixed": 2,
      "fixedRole": "farm",
      "perSlot": 0,
      "slotRole": "farm"
    },
    "buildMonths": 2
  },
  {
    "id": "large_farm",
    "name": "Large Farm",
    "category": "farm",
    "constructionCost": 4000000,
    "monthlyOperatingCost": 18000,
    "footprint": {
      "width": 5,
      "height": 5
    },
    "maxUnits": 6,
    "producibleTiers": [
      "raw"
    ],
    "targetHeadcount": {
      "min": 20,
      "max": 50
    },
    "geographyRequirement": {
      "arable": true
    },
    "staff": {
      "fixed": 4,
      "fixedRole": "farm",
      "perSlot": 0,
      "slotRole": "farm"
    },
    "buildMonths": 3
  },
  {
    "id": "small_plantation",
    "name": "Small Plantation",
    "category": "plantation",
    "constructionCost": 1800000,
    "monthlyOperatingCost": 9000,
    "footprint": {
      "width": 3,
      "height": 3
    },
    "maxUnits": 3,
    "producibleTiers": [
      "raw"
    ],
    "targetHeadcount": {
      "min": 8,
      "max": 20
    },
    "geographyRequirement": {
      "arable": true
    },
    "staff": {
      "fixed": 3,
      "fixedRole": "farm",
      "perSlot": 0,
      "slotRole": "farm"
    },
    "buildMonths": 3
  },
  {
    "id": "iron_mine",
    "name": "Iron Mine",
    "category": "mine",
    "constructionCost": 12000000,
    "monthlyOperatingCost": 60000,
    "footprint": {
      "width": 3,
      "height": 3
    },
    "maxUnits": 3,
    "producibleTiers": [
      "raw"
    ],
    "targetHeadcount": {
      "min": 15,
      "max": 40
    },
    "geographyRequirement": {
      "mineralRich": true
    },
    "staff": {
      "fixed": 10,
      "fixedRole": "extraction",
      "perSlot": 0,
      "slotRole": "extraction"
    },
    "buildMonths": 10
  },
  {
    "id": "oil_well",
    "name": "Oil Well",
    "category": "oil_well",
    "constructionCost": 6000000,
    "monthlyOperatingCost": 30000,
    "footprint": {
      "width": 2,
      "height": 2
    },
    "maxUnits": 2,
    "producibleTiers": [
      "raw"
    ],
    "targetHeadcount": {
      "min": 10,
      "max": 25
    },
    "geographyRequirement": {
      "oilRich": true
    },
    "levels": [
      {
        "level": 1,
        "capacity": 2,
        "monthlyOperatingCost": 30000,
        "upgradeCost": 0
      },
      {
        "level": 2,
        "capacity": 3,
        "monthlyOperatingCost": 39000,
        "upgradeCost": 3600000
      },
      {
        "level": 3,
        "capacity": 4,
        "monthlyOperatingCost": 48000,
        "upgradeCost": 3000000
      }
    ],
    "staff": {
      "fixed": 4,
      "fixedRole": "extraction",
      "perSlot": 0,
      "slotRole": "extraction"
    },
    "buildMonths": 4
  },
  {
    "id": "factory_small",
    "name": "Small Factory",
    "category": "factory",
    "constructionCost": 15000000,
    "monthlyOperatingCost": 45000,
    "footprint": {
      "width": 3,
      "height": 3
    },
    "maxUnits": 6,
    "producibleTiers": [
      "intermediate",
      "finished"
    ],
    "targetHeadcount": {
      "min": 20,
      "max": 60
    },
    "levels": [
      {
        "level": 1,
        "capacity": 6,
        "monthlyOperatingCost": 45000,
        "upgradeCost": 0
      },
      {
        "level": 2,
        "capacity": 9,
        "monthlyOperatingCost": 58500,
        "upgradeCost": 9000000
      },
      {
        "level": 3,
        "capacity": 12,
        "monthlyOperatingCost": 72000,
        "upgradeCost": 7500000
      }
    ],
    "staff": {
      "fixed": 12,
      "fixedRole": "admin",
      "perSlot": 0,
      "slotRole": "production"
    },
    "buildMonths": 5
  },
  {
    "id": "factory_large",
    "name": "Large Factory",
    "category": "factory",
    "constructionCost": 48000000,
    "monthlyOperatingCost": 120000,
    "footprint": {
      "width": 5,
      "height": 5
    },
    "maxUnits": 12,
    "producibleTiers": [
      "intermediate",
      "finished"
    ],
    "targetHeadcount": {
      "min": 60,
      "max": 200
    },
    "levels": [
      {
        "level": 1,
        "capacity": 12,
        "monthlyOperatingCost": 120000,
        "upgradeCost": 0
      },
      {
        "level": 2,
        "capacity": 18,
        "monthlyOperatingCost": 156000,
        "upgradeCost": 28800000
      },
      {
        "level": 3,
        "capacity": 24,
        "monthlyOperatingCost": 192000,
        "upgradeCost": 24000000
      }
    ],
    "staff": {
      "fixed": 30,
      "fixedRole": "admin",
      "perSlot": 0,
      "slotRole": "production"
    },
    "buildMonths": 8
  }
]
